{
  "name": "aura.helplines",
  "version": 1,
  "verifiedOn": "2026-09-24",
  "review": {
    "status": "draft",
    "note": "Numbers are PRD 06c F9 / REQ-SAFE-02 (India Tele-MANAS 14416 / 1-800-891-4416, 112, Childline 1098 for under-18s; US 988). Re-verify every number quarterly and before EU/UK/AU open (PRD 18 'Helplines by country'): a wrong number is a P0 bug. te and te-Latn names NEED NATIVE REVIEW (docs/l10n/helplines-and-emails.md).",
    "open": [
      "Childline 1098 is [ASSUMPTION: confirm operational] in PRD 06c F9; confirm before alpha.",
      "hi / hi-Latn names are not written yet: the app shows English until they are (beta)."
    ]
  },
  "countries": {
    "IN": [
      {
        "id": "in.tele_manas",
        "number": "14416",
        "dial": "14416",
        "audience": "everyone",
        "names": {
          "en": "Tele-MANAS · free, 24×7",
          "te": "Tele-MANAS · ఉచితం, 24×7",
          "te-Latn": "Tele-MANAS · free, 24×7"
        }
      },
      {
        "id": "in.tele_manas_toll_free",
        "number": "1-800-891-4416",
        "dial": "18008914416",
        "audience": "everyone",
        "names": {
          "en": "Tele-MANAS toll-free",
          "te": "Tele-MANAS టోల్-ఫ్రీ",
          "te-Latn": "Tele-MANAS toll-free"
        }
      },
      {
        "id": "in.childline",
        "number": "1098",
        "dial": "1098",
        "audience": "minors",
        "names": {
          "en": "Childline · for under-18s",
          "te": "Childline · 18 ఏళ్ల లోపు వారికి",
          "te-Latn": "Childline · 18 ella lopu vaallaki"
        }
      },
      {
        "id": "in.emergency",
        "number": "112",
        "dial": "112",
        "audience": "everyone",
        "names": {
          "en": "Emergency",
          "te": "అత్యవసరం",
          "te-Latn": "Emergency"
        }
      }
    ],
    "US": [
      {
        "id": "us.988",
        "number": "988",
        "dial": "988",
        "audience": "everyone",
        "names": {
          "en": "Suicide & Crisis Lifeline · call or text",
          "te": "Suicide & Crisis Lifeline · కాల్ లేదా మెసేజ్",
          "te-Latn": "Suicide & Crisis Lifeline · call leda text"
        }
      }
    ]
  }
}
